{
  "schemaVersion": "1.0",
  "chart": {
    "id": "albums-weekly-2026-W29",
    "entityType": "albums",
    "periodType": "weekly",
    "title": "PERSONAL ALBUM 50"
  },
  "period": {
    "key": "2026-W29",
    "label": "2026 年第 29 周",
    "scheduledAt": "2026-07-18T22:00:00+08:00",
    "status": "collecting"
  },
  "collection": {
    "collectedAt": "2026-07-18T22:00:00+08:00",
    "coverage": 0.2857142857142857,
    "status": "partial",
    "sourceSnapshot": null
  },
  "scoringVersions": {
    "netease": "netease-streaming-v1",
    "physical": "external-ledger-v1",
    "bilibili": "external-ledger-v1",
    "combined": "combined-v1"
  },
  "entries": [
    {
      "entityId": "netease-album-192833347",
      "entity": {
        "title": "THE TORTURED POETS DEPARTMENT: THE ANTHOLOGY",
        "subtitle": "Taylor Swift / Post Malone",
        "detail": "20 首歌曲参与统计",
        "artists": [
          {
            "id": "netease-artist-44266",
            "name": "Taylor Swift"
          },
          {
            "id": "netease-artist-1057092",
            "name": "Post Malone"
          }
        ],
        "coverUrl": "http://p2.music.126.net/dzSZAgIjIYJ3iLqFfKrrlQ==/109951169510761055.jpg",
        "coverColor": "#6d3887"
      },
      "rank": {
        "current": 1,
        "previous": null,
        "movement": {
          "type": "new",
          "value": 0
        }
      },
      "points": {
        "netease": 2222.0,
        "physical": 0.0,
        "bilibili": 0.0,
        "other": 0.0,
        "legacyBonus": 0.0,
        "manualAdjustment": 0.0,
        "total": 2222.0
      },
      "record": {
        "peak": 1,
        "periods": 1,
        "championships": 0
      }
    },
    {
      "entityId": "netease-album-120321112",
      "entity": {
        "title": "evermore (deluxe version)",
        "subtitle": "Taylor Swift / Bon Iver / The National",
        "detail": "14 首歌曲参与统计",
        "artists": [
          {
            "id": "netease-artist-44266",
            "name": "Taylor Swift"
          },
          {
            "id": "netease-artist-29337",
            "name": "Bon Iver"
          },
          {
            "id": "netease-artist-102057",
            "name": "The National"
          }
        ],
        "coverUrl": "http://p2.music.126.net/If9lAb2HxDreXr91BRTYdw==/109951173366340878.jpg",
        "coverColor": "#02c639"
      },
      "rank": {
        "current": 2,
        "previous": null,
        "movement": {
          "type": "new",
          "value": 0
        }
      },
      "points": {
        "netease": 1941.0,
        "physical": 0.0,
        "bilibili": 0.0,
        "other": 0.0,
        "legacyBonus": 0.0,
        "manualAdjustment": 0.0,
        "total": 1941.0
      },
      "record": {
        "peak": 2,
        "periods": 1,
        "championships": 0
      }
    },
    {
      "entityId": "netease-album-183236625",
      "entity": {
        "title": "Fe3O4: BREAK",
        "subtitle": "NMIXX",
        "detail": "6 首歌曲参与统计",
        "artists": [
          {
            "id": "netease-artist-51480970",
            "name": "NMIXX"
          }
        ],
        "coverUrl": "http://p2.music.126.net/5tJzpo0e9DoNKSp5d-3Oqg==/109951169261472921.jpg",
        "coverColor": "#26253a"
      },
      "rank": {
        "current": 3,
        "previous": null,
        "movement": {
          "type": "new",
          "value": 0
        }
      },
      "points": {
        "netease": 1361.0,
        "physical": 0.0,
        "bilibili": 0.0,
        "other": 0.0,
        "legacyBonus": 0.0,
        "manualAdjustment": 0.0,
        "total": 1361.0
      },
      "record": {
        "peak": 3,
        "periods": 1,
        "championships": 0
      }
    },
    {
      "entityId": "netease-album-288114758",
      "entity": {
        "title": "Blue Valentine",
        "subtitle": "NMIXX",
        "detail": "4 首歌曲参与统计",
        "artists": [
          {
            "id": "netease-artist-51480970",
            "name": "NMIXX"
          }
        ],
        "coverUrl": "http://p2.music.126.net/wRDGhwhhzJuUkWMrjrPwKw==/109951172137146717.jpg",
        "coverColor": "#ffcda8"
      },
      "rank": {
        "current": 4,
        "previous": null,
        "movement": {
          "type": "new",
          "value": 0
        }
      },
      "points": {
        "netease": 1299.0,
        "physical": 0.0,
        "bilibili": 0.0,
        "other": 0.0,
        "legacyBonus": 0.0,
        "manualAdjustment": 0.0,
        "total": 1299.0
      },
      "record": {
        "peak": 4,
        "periods": 1,
        "championships": 0
      }
    },
    {
      "entityId": "netease-album-263973886",
      "entity": {
        "title": "Fe3O4: FORWARD",
        "subtitle": "NMIXX",
        "detail": "3 首歌曲参与统计",
        "artists": [
          {
            "id": "netease-artist-51480970",
            "name": "NMIXX"
          }
        ],
        "coverUrl": "http://p2.music.126.net/Y7mI4NpwoCxQiVnSOJN1zA==/109951170607144555.jpg",
        "coverColor": "#809212"
      },
      "rank": {
        "current": 5,
        "previous": null,
        "movement": {
          "type": "new",
          "value": 0
        }
      },
      "points": {
        "netease": 1102.0,
        "physical": 0.0,
        "bilibili": 0.0,
        "other": 0.0,
        "legacyBonus": 0.0,
        "manualAdjustment": 0.0,
        "total": 1102.0
      },
      "record": {
        "peak": 5,
        "periods": 1,
        "championships": 0
      }
    },
    {
      "entityId": "netease-album-80752440",
      "entity": {
        "title": "Lover",
        "subtitle": "Taylor Swift / Brendon Urie / The Chicks",
        "detail": "20 首歌曲参与统计",
        "artists": [
          {
            "id": "netease-artist-44266",
            "name": "Taylor Swift"
          },
          {
            "id": "netease-artist-28076769",
            "name": "Brendon Urie"
          },
          {
            "id": "netease-artist-90517",
            "name": "The Chicks"
          }
        ],
        "coverUrl": "http://p2.music.126.net/6CB6Jsmb7k7qiJqfMY5Row==/109951164260234943.jpg",
        "coverColor": "#a5cc30"
      },
      "rank": {
        "current": 6,
        "previous": null,
        "movement": {
          "type": "new",
          "value": 0
        }
      },
      "points": {
        "netease": 657.0,
        "physical": 268.8125,
        "bilibili": 0.0,
        "other": 0.0,
        "legacyBonus": 0.0,
        "manualAdjustment": 0.0,
        "total": 925.8125
      },
      "record": {
        "peak": 6,
        "periods": 1,
        "championships": 0
      }
    },
    {
      "entityId": "netease-album-153345099",
      "entity": {
        "title": "Midnights (3am Edition)",
        "subtitle": "Taylor Swift / Lana Del Rey",
        "detail": "6 首歌曲参与统计",
        "artists": [
          {
            "id": "netease-artist-44266",
            "name": "Taylor Swift"
          },
          {
            "id": "netease-artist-66212",
            "name": "Lana Del Rey"
          }
        ],
        "coverUrl": "http://p2.music.126.net/lKhXKmONQahzGsRdhoDR7w==/109951168178695711.jpg",
        "coverColor": "#f81979"
      },
      "rank": {
        "current": 7,
        "previous": null,
        "movement": {
          "type": "new",
          "value": 0
        }
      },
      "points": {
        "netease": 868.0,
        "physical": 0.0,
        "bilibili": 0.0,
        "other": 0.0,
        "legacyBonus": 0.0,
        "manualAdjustment": 0.0,
        "total": 868.0
      },
      "record": {
        "peak": 7,
        "periods": 1,
        "championships": 0
      }
    },
    {
      "entityId": "netease-album-151840133",
      "entity": {
        "title": "ENTWURF",
        "subtitle": "NMIXX",
        "detail": "2 首歌曲参与统计",
        "artists": [
          {
            "id": "netease-artist-51480970",
            "name": "NMIXX"
          }
        ],
        "coverUrl": "http://p2.music.126.net/fwesTHBVyEL5W8VEAYcxvw==/109951167891220223.jpg",
        "coverColor": "#18db5b"
      },
      "rank": {
        "current": 8,
        "previous": null,
        "movement": {
          "type": "new",
          "value": 0
        }
      },
      "points": {
        "netease": 766.0,
        "physical": 0.0,
        "bilibili": 0.0,
        "other": 0.0,
        "legacyBonus": 0.0,
        "manualAdjustment": 0.0,
        "total": 766.0
      },
      "record": {
        "peak": 8,
        "periods": 1,
        "championships": 0
      }
    },
    {
      "entityId": "netease-album-1770428",
      "entity": {
        "title": "Red",
        "subtitle": "Taylor Swift",
        "detail": "5 首歌曲参与统计",
        "artists": [
          {
            "id": "netease-artist-44266",
            "name": "Taylor Swift"
          }
        ],
        "coverUrl": "http://p2.music.126.net/WS5zt4tq5KBONXcAktO2lA==/109951169270236134.jpg",
        "coverColor": "#91d023"
      },
      "rank": {
        "current": 9,
        "previous": null,
        "movement": {
          "type": "new",
          "value": 0
        }
      },
      "points": {
        "netease": 597.0,
        "physical": 0.0,
        "bilibili": 0.0,
        "other": 0.0,
        "legacyBonus": 0.0,
        "manualAdjustment": 0.0,
        "total": 597.0
      },
      "record": {
        "peak": 9,
        "periods": 1,
        "championships": 0
      }
    },
    {
      "entityId": "netease-album-169354350",
      "entity": {
        "title": "A Midsummer NMIXX's Dream",
        "subtitle": "NMIXX",
        "detail": "2 首歌曲参与统计",
        "artists": [
          {
            "id": "netease-artist-51480970",
            "name": "NMIXX"
          }
        ],
        "coverUrl": "http://p2.music.126.net/_D78HhIawnP39LnGe2BN0g==/109951168730733118.jpg",
        "coverColor": "#b78547"
      },
      "rank": {
        "current": 10,
        "previous": null,
        "movement": {